{
  "schema_version": "1.0",
  "generated_at": "2026-10-22T15:14:20.516437+00:00",
  "environment": {
    "regime": "defense",
    "indices": [
      {
        "code": "000300",
        "name": "沪深300",
        "template_pass": 2,
        "criteria": [
          false,
          false,
          false,
          false,
          false,
          true,
          false,
          true
        ],
        "close": 4036.297
      },
      {
        "code": "000905",
        "name": "中证500",
        "template_pass": 2,
        "criteria": [
          false,
          false,
          true,
          false,
          false,
          false,
          false,
          true
        ],
        "close": 6655.25
      },
      {
        "code": "399006",
        "name": "创业板指",
        "template_pass": 2,
        "criteria": [
          false,
          true,
          false,
          false,
          false,
          false,
          false,
          true
        ],
        "close": 2576.901
      }
    ],
    "breadth": {
      "source": "market_temperature.json",
      "as_of": "2026-10-21",
      "stale": false,
      "ma20_pct": 0.186,
      "ma60_pct": 0.222,
      "ma120_pct": 0.188
    },
    "source_status": {
      "indices": "ok",
      "rs_benchmark": "ok",
      "spot": "ok",
      "breadth": "ok",
      "universe": "ok",
      "vol": "ok"
    }
  },
  "candidates": [
    {
      "code": "600830",
      "name": "香溢融通",
      "composite_score": 3.7,
      "stage": 4,
      "template_pass": 1,
      "rs_pct": 63.2,
      "vcp": {
        "contractions": 2,
        "depth_pct": 20.5,
        "quality": 0.3557,
        "volume_dryup": true
      },
      "pivot": 10.16,
      "buy_zone_low": 10.16,
      "buy_zone_high": 10.668,
      "stop": 9.3472,
      "state": "watch",
      "limit_up_unexecutable": false,
      "chg_pct": -4.6,
      "board": "main",
      "vol_forecast_ann": null
    },
    {
      "code": "600572",
      "name": "康恩贝",
      "composite_score": 3.5,
      "stage": 4,
      "template_pass": 3,
      "rs_pct": 39.7,
      "vcp": {
        "contractions": 3,
        "depth_pct": 13.1,
        "quality": 0.3032,
        "volume_dryup": true
      },
      "pivot": 4.8,
      "buy_zone_low": 4.8,
      "buy_zone_high": 5.04,
      "stop": 4.416,
      "state": "watch",
      "limit_up_unexecutable": false,
      "chg_pct": -2.8,
      "board": "main",
      "vol_forecast_ann": null
    },
    {
      "code": "002340",
      "name": "格林美",
      "composite_score": 2.4,
      "stage": 4,
      "template_pass": 1,
      "rs_pct": 23.4,
      "vcp": {
        "contractions": 2,
        "depth_pct": 15.6,
        "quality": 0.3196,
        "volume_dryup": true
      },
      "pivot": 6.87,
      "buy_zone_low": 6.87,
      "buy_zone_high": 7.2135,
      "stop": 6.3204,
      "state": "watch",
      "limit_up_unexecutable": false,
      "chg_pct": -1.86,
      "board": "main",
      "vol_forecast_ann": null
    }
  ],
  "universe_stats": {
    "total": 5578,
    "tradable": 2751,
    "stage2": 2751,
    "vcp": 3,
    "top": 3
  }
}